{"componentChunkName":"component---src-templates-markdown-js","path":"/posts_en/infinite-scroll-with-react-hooks","result":{"pageContext":{"node":{"body":"function _extends() { _extends = Object.assign || function (target) { for (var i = 1; i < arguments.length; i++) { var source = arguments[i]; for (var key in source) { if (Object.prototype.hasOwnProperty.call(source, key)) { target[key] = source[key]; } } } return target; }; return _extends.apply(this, arguments); }\n\nfunction _objectWithoutProperties(source, excluded) { if (source == null) return {}; var target = _objectWithoutPropertiesLoose(source, excluded); var key, i; if (Object.getOwnPropertySymbols) { var sourceSymbolKeys = Object.getOwnPropertySymbols(source); for (i = 0; i < sourceSymbolKeys.length; i++) { key = sourceSymbolKeys[i]; if (excluded.indexOf(key) >= 0) continue; if (!Object.prototype.propertyIsEnumerable.call(source, key)) continue; target[key] = source[key]; } } return target; }\n\nfunction _objectWithoutPropertiesLoose(source, excluded) { if (source == null) return {}; var target = {}; var sourceKeys = Object.keys(source); var key, i; for (i = 0; i < sourceKeys.length; i++) { key = sourceKeys[i]; if (excluded.indexOf(key) >= 0) continue; target[key] = source[key]; } return target; }\n\n/* @jsxRuntime classic */\n\n/* @jsx mdx */\nvar _frontmatter = {\n  \"title\": \"Infinite scroll with React Hooks\",\n  \"caption\": \"Photo by Kelly Sikkema no Unsplash\",\n  \"path\": \"/posts_en/infinite-scroll-with-react-hooks\",\n  \"translate\": \"/scroll-infinito-com-react-hooks\",\n  \"date\": \"2020-02-14T00:00:00.000Z\",\n  \"image\": \"images/thumbnail.jpg\",\n  \"excerpt\": \"Infinite scroll is not usual to see on websites nowadays but it may be very useful to show a list without pagination or user interaction. [â€¦]\"\n};\nvar layoutProps = {\n  _frontmatter: _frontmatter\n};\nvar MDXLayout = \"wrapper\";\nreturn function MDXContent(_ref) {\n  var components = _ref.components,\n      props = _objectWithoutProperties(_ref, [\"components\"]);\n\n  return mdx(MDXLayout, _extends({}, layoutProps, props, {\n    components: components,\n    mdxType: \"MDXLayout\"\n  }), mdx(\"p\", null, \"Infinite scroll is not usual to see on websites nowadays but it may be very useful to show a list without pagination or too many user interactions.\"), mdx(\"p\", null, \"Recently I decided to try to build a project using infinite scroll only using React Hooks and the IntersectionObserver Browser API, and it worked very well so I'd like to share with you all how I did.\"), mdx(\"p\", null, \"It will be very simple, I'll use:\"), mdx(\"ul\", null, mdx(\"li\", {\n    parentName: \"ul\"\n  }, \"The useState hook to show a loading icon and store our list.\"), mdx(\"li\", {\n    parentName: \"ul\"\n  }, \"The useEffect hook to fetch our list on our component mount.\"), mdx(\"li\", {\n    parentName: \"ul\"\n  }, \"The useRef hook to get a reference from a element above our list.\"), mdx(\"li\", {\n    parentName: \"ul\"\n  }, \"The IntersectionObserver API method to check wheter this element is visible or not.\")), mdx(\"p\", null, \"I can see all code on \", mdx(\"a\", {\n    parentName: \"p\",\n    \"href\": \"https://github.com/Sergioamjr/react-infinite-scroll-example\"\n  }, \"this repository\"), \" already.\"), mdx(\"h3\", null, \"Building our component\"), mdx(\"p\", null, \"First of all, let's create our component that will show our list.\"), mdx(\"p\", null, \"We will only show the element above our list if there're itens and the current page is smaller than the total page.\"), mdx(\"div\", {\n    \"className\": \"gatsby-highlight\",\n    \"data-language\": \"js\"\n  }, mdx(\"pre\", {\n    parentName: \"div\",\n    \"className\": \"language-js\"\n  }, mdx(\"code\", {\n    parentName: \"pre\",\n    \"className\": \"language-js\"\n  }, mdx(\"span\", {\n    parentName: \"code\",\n    \"className\": \"token keyword\"\n  }, \"import\"), \" React\", mdx(\"span\", {\n    parentName: \"code\",\n    \"className\": \"token punctuation\"\n  }, \",\"), \" \", mdx(\"span\", {\n    parentName: \"code\",\n    \"className\": \"token punctuation\"\n  }, \"{\"), \" useState\", mdx(\"span\", {\n    parentName: \"code\",\n    \"className\": \"token punctuation\"\n  }, \",\"), \" useRef \", mdx(\"span\", {\n    parentName: \"code\",\n    \"className\": \"token punctuation\"\n  }, \"}\"), \" \", mdx(\"span\", {\n    parentName: \"code\",\n    \"className\": \"token keyword\"\n  }, \"from\"), \" \", mdx(\"span\", {\n    parentName: \"code\",\n    \"className\": \"token string\"\n  }, \"\\\"react\\\"\"), mdx(\"span\", {\n    parentName: \"code\",\n    \"className\": \"token punctuation\"\n  }, \";\"), \"\\n\\n\", mdx(\"span\", {\n    parentName: \"code\",\n    \"className\": \"token keyword\"\n  }, \"export\"), \" \", mdx(\"span\", {\n    parentName: \"code\",\n    \"className\": \"token keyword\"\n  }, \"default\"), \" \", mdx(\"span\", {\n    parentName: \"code\",\n    \"className\": \"token keyword\"\n  }, \"function\"), \" \", mdx(\"span\", {\n    parentName: \"code\",\n    \"className\": \"token function\"\n  }, \"App\"), mdx(\"span\", {\n    parentName: \"code\",\n    \"className\": \"token punctuation\"\n  }, \"(\"), mdx(\"span\", {\n    parentName: \"code\",\n    \"className\": \"token punctuation\"\n  }, \")\"), \" \", mdx(\"span\", {\n    parentName: \"code\",\n    \"className\": \"token punctuation\"\n  }, \"{\"), \"\\n  \", mdx(\"span\", {\n    parentName: \"code\",\n    \"className\": \"token keyword\"\n  }, \"const\"), \" lastRef \", mdx(\"span\", {\n    parentName: \"code\",\n    \"className\": \"token operator\"\n  }, \"=\"), \" \", mdx(\"span\", {\n    parentName: \"code\",\n    \"className\": \"token function\"\n  }, \"useRef\"), mdx(\"span\", {\n    parentName: \"code\",\n    \"className\": \"token punctuation\"\n  }, \"(\"), mdx(\"span\", {\n    parentName: \"code\",\n    \"className\": \"token keyword\"\n  }, \"null\"), mdx(\"span\", {\n    parentName: \"code\",\n    \"className\": \"token punctuation\"\n  }, \")\"), mdx(\"span\", {\n    parentName: \"code\",\n    \"className\": \"token punctuation\"\n  }, \";\"), \"\\n  \", mdx(\"span\", {\n    parentName: \"code\",\n    \"className\": \"token keyword\"\n  }, \"const\"), \" \", mdx(\"span\", {\n    parentName: \"code\",\n    \"className\": \"token punctuation\"\n  }, \"[\"), \"isLoading\", mdx(\"span\", {\n    parentName: \"code\",\n    \"className\": \"token punctuation\"\n  }, \",\"), \" setIsLoading\", mdx(\"span\", {\n    parentName: \"code\",\n    \"className\": \"token punctuation\"\n  }, \"]\"), \" \", mdx(\"span\", {\n    parentName: \"code\",\n    \"className\": \"token operator\"\n  }, \"=\"), \" \", mdx(\"span\", {\n    parentName: \"code\",\n    \"className\": \"token function\"\n  }, \"useState\"), mdx(\"span\", {\n    parentName: \"code\",\n    \"className\": \"token punctuation\"\n  }, \"(\"), mdx(\"span\", {\n    parentName: \"code\",\n    \"className\": \"token boolean\"\n  }, \"false\"), mdx(\"span\", {\n    parentName: \"code\",\n    \"className\": \"token punctuation\"\n  }, \")\"), mdx(\"span\", {\n    parentName: \"code\",\n    \"className\": \"token punctuation\"\n  }, \";\"), \"\\n  \", mdx(\"span\", {\n    parentName: \"code\",\n    \"className\": \"token keyword\"\n  }, \"const\"), \" \", mdx(\"span\", {\n    parentName: \"code\",\n    \"className\": \"token punctuation\"\n  }, \"[\"), \"todos\", mdx(\"span\", {\n    parentName: \"code\",\n    \"className\": \"token punctuation\"\n  }, \",\"), \" setTodos\", mdx(\"span\", {\n    parentName: \"code\",\n    \"className\": \"token punctuation\"\n  }, \"]\"), \" \", mdx(\"span\", {\n    parentName: \"code\",\n    \"className\": \"token operator\"\n  }, \"=\"), \" \", mdx(\"span\", {\n    parentName: \"code\",\n    \"className\": \"token function\"\n  }, \"useState\"), mdx(\"span\", {\n    parentName: \"code\",\n    \"className\": \"token punctuation\"\n  }, \"(\"), mdx(\"span\", {\n    parentName: \"code\",\n    \"className\": \"token punctuation\"\n  }, \"{\"), \"\\n    itens\", mdx(\"span\", {\n    parentName: \"code\",\n    \"className\": \"token operator\"\n  }, \":\"), \" \", mdx(\"span\", {\n    parentName: \"code\",\n    \"className\": \"token punctuation\"\n  }, \"[\"), mdx(\"span\", {\n    parentName: \"code\",\n    \"className\": \"token punctuation\"\n  }, \"]\"), mdx(\"span\", {\n    parentName: \"code\",\n    \"className\": \"token punctuation\"\n  }, \",\"), \"\\n    page\", mdx(\"span\", {\n    parentName: \"code\",\n    \"className\": \"token operator\"\n  }, \":\"), \" \", mdx(\"span\", {\n    parentName: \"code\",\n    \"className\": \"token number\"\n  }, \"0\"), mdx(\"span\", {\n    parentName: \"code\",\n    \"className\": \"token punctuation\"\n  }, \",\"), \"\\n    totalPages\", mdx(\"span\", {\n    parentName: \"code\",\n    \"className\": \"token operator\"\n  }, \":\"), \" \", mdx(\"span\", {\n    parentName: \"code\",\n    \"className\": \"token number\"\n  }, \"1\"), mdx(\"span\", {\n    parentName: \"code\",\n    \"className\": \"token punctuation\"\n  }, \",\"), \"\\n  \", mdx(\"span\", {\n    parentName: \"code\",\n    \"className\": \"token punctuation\"\n  }, \"}\"), mdx(\"span\", {\n    parentName: \"code\",\n    \"className\": \"token punctuation\"\n  }, \")\"), mdx(\"span\", {\n    parentName: \"code\",\n    \"className\": \"token punctuation\"\n  }, \";\"), \"\\n\\n  \", mdx(\"span\", {\n    parentName: \"code\",\n    \"className\": \"token keyword\"\n  }, \"return\"), \" \", mdx(\"span\", {\n    parentName: \"code\",\n    \"className\": \"token punctuation\"\n  }, \"(\"), \"\\n    \", mdx(\"span\", {\n    parentName: \"code\",\n    \"className\": \"token operator\"\n  }, \"<\"), \"div\", mdx(\"span\", {\n    parentName: \"code\",\n    \"className\": \"token operator\"\n  }, \">\"), \"\\n      \", mdx(\"span\", {\n    parentName: \"code\",\n    \"className\": \"token operator\"\n  }, \"<\"), \"h2\", mdx(\"span\", {\n    parentName: \"code\",\n    \"className\": \"token operator\"\n  }, \">\"), \"Lorem ipsum's list\", mdx(\"span\", {\n    parentName: \"code\",\n    \"className\": \"token operator\"\n  }, \"<\"), mdx(\"span\", {\n    parentName: \"code\",\n    \"className\": \"token operator\"\n  }, \"/\"), \"h2\", mdx(\"span\", {\n    parentName: \"code\",\n    \"className\": \"token operator\"\n  }, \">\"), \"\\n      \", mdx(\"span\", {\n    parentName: \"code\",\n    \"className\": \"token punctuation\"\n  }, \"{\"), \"todos\", mdx(\"span\", {\n    parentName: \"code\",\n    \"className\": \"token punctuation\"\n  }, \".\"), \"itens\", mdx(\"span\", {\n    parentName: \"code\",\n    \"className\": \"token punctuation\"\n  }, \".\"), mdx(\"span\", {\n    parentName: \"code\",\n    \"className\": \"token function\"\n  }, \"map\"), mdx(\"span\", {\n    parentName: \"code\",\n    \"className\": \"token punctuation\"\n  }, \"(\"), mdx(\"span\", {\n    parentName: \"code\",\n    \"className\": \"token punctuation\"\n  }, \"(\"), mdx(\"span\", {\n    parentName: \"code\",\n    \"className\": \"token parameter\"\n  }, mdx(\"span\", {\n    parentName: \"span\",\n    \"className\": \"token punctuation\"\n  }, \"{\"), \" title \", mdx(\"span\", {\n    parentName: \"span\",\n    \"className\": \"token punctuation\"\n  }, \"}\"), mdx(\"span\", {\n    parentName: \"span\",\n    \"className\": \"token punctuation\"\n  }, \",\"), \" index\"), mdx(\"span\", {\n    parentName: \"code\",\n    \"className\": \"token punctuation\"\n  }, \")\"), \" \", mdx(\"span\", {\n    parentName: \"code\",\n    \"className\": \"token operator\"\n  }, \"=>\"), \" \", mdx(\"span\", {\n    parentName: \"code\",\n    \"className\": \"token punctuation\"\n  }, \"{\"), \"\\n        \", mdx(\"span\", {\n    parentName: \"code\",\n    \"className\": \"token keyword\"\n  }, \"return\"), \" \", mdx(\"span\", {\n    parentName: \"code\",\n    \"className\": \"token punctuation\"\n  }, \"(\"), \"\\n          \", mdx(\"span\", {\n    parentName: \"code\",\n    \"className\": \"token operator\"\n  }, \"<\"), \"div key\", mdx(\"span\", {\n    parentName: \"code\",\n    \"className\": \"token operator\"\n  }, \"=\"), mdx(\"span\", {\n    parentName: \"code\",\n    \"className\": \"token punctuation\"\n  }, \"{\"), \"index\", mdx(\"span\", {\n    parentName: \"code\",\n    \"className\": \"token punctuation\"\n  }, \"}\"), mdx(\"span\", {\n    parentName: \"code\",\n    \"className\": \"token operator\"\n  }, \">\"), \"\\n            \", mdx(\"span\", {\n    parentName: \"code\",\n    \"className\": \"token operator\"\n  }, \"<\"), \"p\", mdx(\"span\", {\n    parentName: \"code\",\n    \"className\": \"token operator\"\n  }, \">\"), mdx(\"span\", {\n    parentName: \"code\",\n    \"className\": \"token punctuation\"\n  }, \"{\"), \"title\", mdx(\"span\", {\n    parentName: \"code\",\n    \"className\": \"token punctuation\"\n  }, \"}\"), mdx(\"span\", {\n    parentName: \"code\",\n    \"className\": \"token operator\"\n  }, \"<\"), mdx(\"span\", {\n    parentName: \"code\",\n    \"className\": \"token operator\"\n  }, \"/\"), \"p\", mdx(\"span\", {\n    parentName: \"code\",\n    \"className\": \"token operator\"\n  }, \">\"), \"\\n          \", mdx(\"span\", {\n    parentName: \"code\",\n    \"className\": \"token operator\"\n  }, \"<\"), mdx(\"span\", {\n    parentName: \"code\",\n    \"className\": \"token operator\"\n  }, \"/\"), \"div\", mdx(\"span\", {\n    parentName: \"code\",\n    \"className\": \"token operator\"\n  }, \">\"), \"\\n        \", mdx(\"span\", {\n    parentName: \"code\",\n    \"className\": \"token punctuation\"\n  }, \")\"), mdx(\"span\", {\n    parentName: \"code\",\n    \"className\": \"token punctuation\"\n  }, \";\"), \"\\n      \", mdx(\"span\", {\n    parentName: \"code\",\n    \"className\": \"token punctuation\"\n  }, \"}\"), mdx(\"span\", {\n    parentName: \"code\",\n    \"className\": \"token punctuation\"\n  }, \")\"), mdx(\"span\", {\n    parentName: \"code\",\n    \"className\": \"token punctuation\"\n  }, \"}\"), \"\\n      \", mdx(\"span\", {\n    parentName: \"code\",\n    \"className\": \"token punctuation\"\n  }, \"{\"), mdx(\"span\", {\n    parentName: \"code\",\n    \"className\": \"token operator\"\n  }, \"!\"), mdx(\"span\", {\n    parentName: \"code\",\n    \"className\": \"token operator\"\n  }, \"!\"), \"todos\", mdx(\"span\", {\n    parentName: \"code\",\n    \"className\": \"token punctuation\"\n  }, \".\"), \"itens\", mdx(\"span\", {\n    parentName: \"code\",\n    \"className\": \"token punctuation\"\n  }, \".\"), \"length \", mdx(\"span\", {\n    parentName: \"code\",\n    \"className\": \"token operator\"\n  }, \"&&\"), \" todos\", mdx(\"span\", {\n    parentName: \"code\",\n    \"className\": \"token punctuation\"\n  }, \".\"), \"page \", mdx(\"span\", {\n    parentName: \"code\",\n    \"className\": \"token operator\"\n  }, \"<\"), \" todos\", mdx(\"span\", {\n    parentName: \"code\",\n    \"className\": \"token punctuation\"\n  }, \".\"), \"totalPages \", mdx(\"span\", {\n    parentName: \"code\",\n    \"className\": \"token operator\"\n  }, \"&&\"), \" \", mdx(\"span\", {\n    parentName: \"code\",\n    \"className\": \"token punctuation\"\n  }, \"(\"), \"\\n        \", mdx(\"span\", {\n    parentName: \"code\",\n    \"className\": \"token operator\"\n  }, \"<\"), \"div ref\", mdx(\"span\", {\n    parentName: \"code\",\n    \"className\": \"token operator\"\n  }, \"=\"), mdx(\"span\", {\n    parentName: \"code\",\n    \"className\": \"token punctuation\"\n  }, \"{\"), \"lastRef\", mdx(\"span\", {\n    parentName: \"code\",\n    \"className\": \"token punctuation\"\n  }, \"}\"), \" \", mdx(\"span\", {\n    parentName: \"code\",\n    \"className\": \"token operator\"\n  }, \"/\"), mdx(\"span\", {\n    parentName: \"code\",\n    \"className\": \"token operator\"\n  }, \">\"), \"\\n      \", mdx(\"span\", {\n    parentName: \"code\",\n    \"className\": \"token punctuation\"\n  }, \")\"), mdx(\"span\", {\n    parentName: \"code\",\n    \"className\": \"token punctuation\"\n  }, \"}\"), \"\\n      \", mdx(\"span\", {\n    parentName: \"code\",\n    \"className\": \"token punctuation\"\n  }, \"{\"), \"isLoading \", mdx(\"span\", {\n    parentName: \"code\",\n    \"className\": \"token operator\"\n  }, \"&&\"), \" \", mdx(\"span\", {\n    parentName: \"code\",\n    \"className\": \"token operator\"\n  }, \"<\"), \"p\", mdx(\"span\", {\n    parentName: \"code\",\n    \"className\": \"token operator\"\n  }, \">\"), \"Loading\", mdx(\"span\", {\n    parentName: \"code\",\n    \"className\": \"token operator\"\n  }, \"...\"), mdx(\"span\", {\n    parentName: \"code\",\n    \"className\": \"token operator\"\n  }, \"<\"), mdx(\"span\", {\n    parentName: \"code\",\n    \"className\": \"token operator\"\n  }, \"/\"), \"p\", mdx(\"span\", {\n    parentName: \"code\",\n    \"className\": \"token operator\"\n  }, \">\"), mdx(\"span\", {\n    parentName: \"code\",\n    \"className\": \"token punctuation\"\n  }, \"}\"), \"\\n    \", mdx(\"span\", {\n    parentName: \"code\",\n    \"className\": \"token operator\"\n  }, \"<\"), mdx(\"span\", {\n    parentName: \"code\",\n    \"className\": \"token operator\"\n  }, \"/\"), \"div\", mdx(\"span\", {\n    parentName: \"code\",\n    \"className\": \"token operator\"\n  }, \">\"), \"\\n  \", mdx(\"span\", {\n    parentName: \"code\",\n    \"className\": \"token punctuation\"\n  }, \")\"), mdx(\"span\", {\n    parentName: \"code\",\n    \"className\": \"token punctuation\"\n  }, \";\"), \"\\n\", mdx(\"span\", {\n    parentName: \"code\",\n    \"className\": \"token punctuation\"\n  }, \"}\")))), mdx(\"h3\", null, \"Fetching some data from an API\"), mdx(\"p\", null, \"We also need a method to fetch some data from an API. I created a method called \", mdx(\"code\", {\n    parentName: \"p\",\n    \"className\": \"language-text\"\n  }, \"fetchTodos\"), \" that receives the page number that I want as parameter. For this example I mocked the returning of this method. If you want to know how I mocked these data, you can see \", mdx(\"a\", {\n    parentName: \"p\",\n    \"href\": \"https://github.com/Sergioamjr/react-infinite-scroll-example/blob/master/src/services/index.js\"\n  }, \"right here\"), \", the only thing you need to know is that I expect this data format:\"), mdx(\"div\", {\n    \"className\": \"gatsby-highlight\",\n    \"data-language\": \"js\"\n  }, mdx(\"pre\", {\n    parentName: \"div\",\n    \"className\": \"language-js\"\n  }, mdx(\"code\", {\n    parentName: \"pre\",\n    \"className\": \"language-js\"\n  }, mdx(\"span\", {\n    parentName: \"code\",\n    \"className\": \"token punctuation\"\n  }, \"{\"), \"\\n  itens\", mdx(\"span\", {\n    parentName: \"code\",\n    \"className\": \"token operator\"\n  }, \":\"), \" \", mdx(\"span\", {\n    parentName: \"code\",\n    \"className\": \"token punctuation\"\n  }, \"[\"), mdx(\"span\", {\n    parentName: \"code\",\n    \"className\": \"token punctuation\"\n  }, \"{\"), mdx(\"span\", {\n    parentName: \"code\",\n    \"className\": \"token operator\"\n  }, \"...\"), mdx(\"span\", {\n    parentName: \"code\",\n    \"className\": \"token punctuation\"\n  }, \"}\"), mdx(\"span\", {\n    parentName: \"code\",\n    \"className\": \"token punctuation\"\n  }, \"]\"), mdx(\"span\", {\n    parentName: \"code\",\n    \"className\": \"token punctuation\"\n  }, \",\"), \"\\n  totalPages\", mdx(\"span\", {\n    parentName: \"code\",\n    \"className\": \"token operator\"\n  }, \":\"), \" number\", mdx(\"span\", {\n    parentName: \"code\",\n    \"className\": \"token punctuation\"\n  }, \",\"), \"\\n  page\", mdx(\"span\", {\n    parentName: \"code\",\n    \"className\": \"token operator\"\n  }, \":\"), \" number\", mdx(\"span\", {\n    parentName: \"code\",\n    \"className\": \"token punctuation\"\n  }, \",\"), \"\\n\", mdx(\"span\", {\n    parentName: \"code\",\n    \"className\": \"token punctuation\"\n  }, \"}\")))), mdx(\"h3\", null, \"Writing our Custom Hooks useIsElementVisible.\"), mdx(\"p\", null, \"Now we will create our custom hook that check wheter an element is visible on our screen or not, using the browser method IntersectionObserver API.\"), mdx(\"div\", {\n    \"className\": \"gatsby-highlight\",\n    \"data-language\": \"js\"\n  }, mdx(\"pre\", {\n    parentName: \"div\",\n    \"className\": \"language-js\"\n  }, mdx(\"code\", {\n    parentName: \"pre\",\n    \"className\": \"language-js\"\n  }, mdx(\"span\", {\n    parentName: \"code\",\n    \"className\": \"token keyword\"\n  }, \"import\"), \" \", mdx(\"span\", {\n    parentName: \"code\",\n    \"className\": \"token punctuation\"\n  }, \"{\"), \" useEffect\", mdx(\"span\", {\n    parentName: \"code\",\n    \"className\": \"token punctuation\"\n  }, \",\"), \" useState \", mdx(\"span\", {\n    parentName: \"code\",\n    \"className\": \"token punctuation\"\n  }, \"}\"), \" \", mdx(\"span\", {\n    parentName: \"code\",\n    \"className\": \"token keyword\"\n  }, \"from\"), \" \", mdx(\"span\", {\n    parentName: \"code\",\n    \"className\": \"token string\"\n  }, \"\\\"react\\\"\"), mdx(\"span\", {\n    parentName: \"code\",\n    \"className\": \"token punctuation\"\n  }, \";\"), \"\\n\\n\", mdx(\"span\", {\n    parentName: \"code\",\n    \"className\": \"token keyword\"\n  }, \"export\"), \" \", mdx(\"span\", {\n    parentName: \"code\",\n    \"className\": \"token keyword\"\n  }, \"default\"), \" \", mdx(\"span\", {\n    parentName: \"code\",\n    \"className\": \"token punctuation\"\n  }, \"(\"), mdx(\"span\", {\n    parentName: \"code\",\n    \"className\": \"token parameter\"\n  }, \"el\"), mdx(\"span\", {\n    parentName: \"code\",\n    \"className\": \"token punctuation\"\n  }, \")\"), \" \", mdx(\"span\", {\n    parentName: \"code\",\n    \"className\": \"token operator\"\n  }, \"=>\"), \" \", mdx(\"span\", {\n    parentName: \"code\",\n    \"className\": \"token punctuation\"\n  }, \"{\"), \"\\n  \", mdx(\"span\", {\n    parentName: \"code\",\n    \"className\": \"token keyword\"\n  }, \"const\"), \" \", mdx(\"span\", {\n    parentName: \"code\",\n    \"className\": \"token punctuation\"\n  }, \"[\"), \"isVisible\", mdx(\"span\", {\n    parentName: \"code\",\n    \"className\": \"token punctuation\"\n  }, \",\"), \" setIsVisible\", mdx(\"span\", {\n    parentName: \"code\",\n    \"className\": \"token punctuation\"\n  }, \"]\"), \" \", mdx(\"span\", {\n    parentName: \"code\",\n    \"className\": \"token operator\"\n  }, \"=\"), \" \", mdx(\"span\", {\n    parentName: \"code\",\n    \"className\": \"token function\"\n  }, \"useState\"), mdx(\"span\", {\n    parentName: \"code\",\n    \"className\": \"token punctuation\"\n  }, \"(\"), mdx(\"span\", {\n    parentName: \"code\",\n    \"className\": \"token boolean\"\n  }, \"false\"), mdx(\"span\", {\n    parentName: \"code\",\n    \"className\": \"token punctuation\"\n  }, \")\"), mdx(\"span\", {\n    parentName: \"code\",\n    \"className\": \"token punctuation\"\n  }, \";\"), \"\\n  \", mdx(\"span\", {\n    parentName: \"code\",\n    \"className\": \"token keyword\"\n  }, \"const\"), \" \", mdx(\"span\", {\n    parentName: \"code\",\n    \"className\": \"token function-variable function\"\n  }, \"callback\"), \" \", mdx(\"span\", {\n    parentName: \"code\",\n    \"className\": \"token operator\"\n  }, \"=\"), \" \", mdx(\"span\", {\n    parentName: \"code\",\n    \"className\": \"token punctuation\"\n  }, \"(\"), mdx(\"span\", {\n    parentName: \"code\",\n    \"className\": \"token parameter\"\n  }, mdx(\"span\", {\n    parentName: \"span\",\n    \"className\": \"token punctuation\"\n  }, \"[\"), \"entry\", mdx(\"span\", {\n    parentName: \"span\",\n    \"className\": \"token punctuation\"\n  }, \"]\")), mdx(\"span\", {\n    parentName: \"code\",\n    \"className\": \"token punctuation\"\n  }, \")\"), \" \", mdx(\"span\", {\n    parentName: \"code\",\n    \"className\": \"token operator\"\n  }, \"=>\"), \" \", mdx(\"span\", {\n    parentName: \"code\",\n    \"className\": \"token punctuation\"\n  }, \"{\"), \"\\n    \", mdx(\"span\", {\n    parentName: \"code\",\n    \"className\": \"token function\"\n  }, \"setIsVisible\"), mdx(\"span\", {\n    parentName: \"code\",\n    \"className\": \"token punctuation\"\n  }, \"(\"), \"entry\", mdx(\"span\", {\n    parentName: \"code\",\n    \"className\": \"token punctuation\"\n  }, \".\"), \"isIntersecting\", mdx(\"span\", {\n    parentName: \"code\",\n    \"className\": \"token punctuation\"\n  }, \")\"), mdx(\"span\", {\n    parentName: \"code\",\n    \"className\": \"token punctuation\"\n  }, \";\"), \"\\n  \", mdx(\"span\", {\n    parentName: \"code\",\n    \"className\": \"token punctuation\"\n  }, \"}\"), mdx(\"span\", {\n    parentName: \"code\",\n    \"className\": \"token punctuation\"\n  }, \";\"), \"\\n\\n  \", mdx(\"span\", {\n    parentName: \"code\",\n    \"className\": \"token function\"\n  }, \"useEffect\"), mdx(\"span\", {\n    parentName: \"code\",\n    \"className\": \"token punctuation\"\n  }, \"(\"), mdx(\"span\", {\n    parentName: \"code\",\n    \"className\": \"token punctuation\"\n  }, \"(\"), mdx(\"span\", {\n    parentName: \"code\",\n    \"className\": \"token punctuation\"\n  }, \")\"), \" \", mdx(\"span\", {\n    parentName: \"code\",\n    \"className\": \"token operator\"\n  }, \"=>\"), \" \", mdx(\"span\", {\n    parentName: \"code\",\n    \"className\": \"token punctuation\"\n  }, \"{\"), \"\\n    \", mdx(\"span\", {\n    parentName: \"code\",\n    \"className\": \"token keyword\"\n  }, \"const\"), \" watch \", mdx(\"span\", {\n    parentName: \"code\",\n    \"className\": \"token operator\"\n  }, \"=\"), \" \", mdx(\"span\", {\n    parentName: \"code\",\n    \"className\": \"token keyword\"\n  }, \"new\"), \" \", mdx(\"span\", {\n    parentName: \"code\",\n    \"className\": \"token class-name\"\n  }, \"IntersectionObserver\"), mdx(\"span\", {\n    parentName: \"code\",\n    \"className\": \"token punctuation\"\n  }, \"(\"), \"callback\", mdx(\"span\", {\n    parentName: \"code\",\n    \"className\": \"token punctuation\"\n  }, \")\"), mdx(\"span\", {\n    parentName: \"code\",\n    \"className\": \"token punctuation\"\n  }, \";\"), \"\\n    \", mdx(\"span\", {\n    parentName: \"code\",\n    \"className\": \"token keyword\"\n  }, \"if\"), \" \", mdx(\"span\", {\n    parentName: \"code\",\n    \"className\": \"token punctuation\"\n  }, \"(\"), \"el\", mdx(\"span\", {\n    parentName: \"code\",\n    \"className\": \"token punctuation\"\n  }, \")\"), \" \", mdx(\"span\", {\n    parentName: \"code\",\n    \"className\": \"token punctuation\"\n  }, \"{\"), \"\\n      watch\", mdx(\"span\", {\n    parentName: \"code\",\n    \"className\": \"token punctuation\"\n  }, \".\"), mdx(\"span\", {\n    parentName: \"code\",\n    \"className\": \"token function\"\n  }, \"observe\"), mdx(\"span\", {\n    parentName: \"code\",\n    \"className\": \"token punctuation\"\n  }, \"(\"), \"el\", mdx(\"span\", {\n    parentName: \"code\",\n    \"className\": \"token punctuation\"\n  }, \")\"), mdx(\"span\", {\n    parentName: \"code\",\n    \"className\": \"token punctuation\"\n  }, \";\"), \"\\n      \", mdx(\"span\", {\n    parentName: \"code\",\n    \"className\": \"token keyword\"\n  }, \"return\"), \" \", mdx(\"span\", {\n    parentName: \"code\",\n    \"className\": \"token punctuation\"\n  }, \"(\"), mdx(\"span\", {\n    parentName: \"code\",\n    \"className\": \"token punctuation\"\n  }, \")\"), \" \", mdx(\"span\", {\n    parentName: \"code\",\n    \"className\": \"token operator\"\n  }, \"=>\"), \" watch\", mdx(\"span\", {\n    parentName: \"code\",\n    \"className\": \"token punctuation\"\n  }, \".\"), mdx(\"span\", {\n    parentName: \"code\",\n    \"className\": \"token function\"\n  }, \"unobserve\"), mdx(\"span\", {\n    parentName: \"code\",\n    \"className\": \"token punctuation\"\n  }, \"(\"), \"el\", mdx(\"span\", {\n    parentName: \"code\",\n    \"className\": \"token punctuation\"\n  }, \")\"), mdx(\"span\", {\n    parentName: \"code\",\n    \"className\": \"token punctuation\"\n  }, \";\"), \"\\n    \", mdx(\"span\", {\n    parentName: \"code\",\n    \"className\": \"token punctuation\"\n  }, \"}\"), \"\\n  \", mdx(\"span\", {\n    parentName: \"code\",\n    \"className\": \"token punctuation\"\n  }, \"}\"), mdx(\"span\", {\n    parentName: \"code\",\n    \"className\": \"token punctuation\"\n  }, \",\"), \" \", mdx(\"span\", {\n    parentName: \"code\",\n    \"className\": \"token punctuation\"\n  }, \"[\"), \"el\", mdx(\"span\", {\n    parentName: \"code\",\n    \"className\": \"token punctuation\"\n  }, \"]\"), mdx(\"span\", {\n    parentName: \"code\",\n    \"className\": \"token punctuation\"\n  }, \")\"), mdx(\"span\", {\n    parentName: \"code\",\n    \"className\": \"token punctuation\"\n  }, \";\"), \"\\n\\n  \", mdx(\"span\", {\n    parentName: \"code\",\n    \"className\": \"token keyword\"\n  }, \"return\"), \" isVisible \", mdx(\"span\", {\n    parentName: \"code\",\n    \"className\": \"token operator\"\n  }, \"&&\"), \" \", mdx(\"span\", {\n    parentName: \"code\",\n    \"className\": \"token operator\"\n  }, \"!\"), mdx(\"span\", {\n    parentName: \"code\",\n    \"className\": \"token operator\"\n  }, \"!\"), \"el\", mdx(\"span\", {\n    parentName: \"code\",\n    \"className\": \"token punctuation\"\n  }, \";\"), \"\\n\", mdx(\"span\", {\n    parentName: \"code\",\n    \"className\": \"token punctuation\"\n  }, \"}\"), mdx(\"span\", {\n    parentName: \"code\",\n    \"className\": \"token punctuation\"\n  }, \";\")))), mdx(\"p\", null, \"Our goal it's pass a element reference to see wheter the element above list is visible on our screen or not. If so, we'll call the method to fetch more data.\"), mdx(\"h3\", null, \"Updating our component\"), mdx(\"p\", null, \"Everything is settled so far, now let's create our method to fetch the data. We'll use the hook useEffetch twice; on the page mount and whenever the element above our list is visible.\"), mdx(\"div\", {\n    \"className\": \"gatsby-highlight has-highlighted-lines\",\n    \"data-language\": \"js\"\n  }, mdx(\"pre\", {\n    parentName: \"div\",\n    \"className\": \"language-js\"\n  }, mdx(\"code\", {\n    parentName: \"pre\",\n    \"className\": \"language-js\"\n  }, mdx(\"span\", {\n    parentName: \"code\",\n    \"className\": \"gatsby-highlight-code-line\"\n  }, mdx(\"span\", {\n    parentName: \"span\",\n    \"className\": \"token keyword\"\n  }, \"import\"), \" React\", mdx(\"span\", {\n    parentName: \"span\",\n    \"className\": \"token punctuation\"\n  }, \",\"), \" \", mdx(\"span\", {\n    parentName: \"span\",\n    \"className\": \"token punctuation\"\n  }, \"{\"), \" useState\", mdx(\"span\", {\n    parentName: \"span\",\n    \"className\": \"token punctuation\"\n  }, \",\"), \" useEffect\", mdx(\"span\", {\n    parentName: \"span\",\n    \"className\": \"token punctuation\"\n  }, \",\"), \" useRef \", mdx(\"span\", {\n    parentName: \"span\",\n    \"className\": \"token punctuation\"\n  }, \"}\"), \" \", mdx(\"span\", {\n    parentName: \"span\",\n    \"className\": \"token keyword\"\n  }, \"from\"), \" \", mdx(\"span\", {\n    parentName: \"span\",\n    \"className\": \"token string\"\n  }, \"\\\"react\\\"\"), mdx(\"span\", {\n    parentName: \"span\",\n    \"className\": \"token punctuation\"\n  }, \";\")), mdx(\"span\", {\n    parentName: \"code\",\n    \"className\": \"token keyword\"\n  }, \"import\"), \" useIsElementVisible \", mdx(\"span\", {\n    parentName: \"code\",\n    \"className\": \"token keyword\"\n  }, \"from\"), \" \", mdx(\"span\", {\n    parentName: \"code\",\n    \"className\": \"token string\"\n  }, \"\\\"./hooks/useIsElementVisible\\\"\"), mdx(\"span\", {\n    parentName: \"code\",\n    \"className\": \"token punctuation\"\n  }, \";\"), \"\\n\", mdx(\"span\", {\n    parentName: \"code\",\n    \"className\": \"token keyword\"\n  }, \"import\"), \" \", mdx(\"span\", {\n    parentName: \"code\",\n    \"className\": \"token punctuation\"\n  }, \"{\"), \" fetchTodos \", mdx(\"span\", {\n    parentName: \"code\",\n    \"className\": \"token punctuation\"\n  }, \"}\"), \" \", mdx(\"span\", {\n    parentName: \"code\",\n    \"className\": \"token keyword\"\n  }, \"from\"), \" \", mdx(\"span\", {\n    parentName: \"code\",\n    \"className\": \"token string\"\n  }, \"\\\"./services\\\"\"), mdx(\"span\", {\n    parentName: \"code\",\n    \"className\": \"token punctuation\"\n  }, \";\"), \"\\n\\n\", mdx(\"span\", {\n    parentName: \"code\",\n    \"className\": \"token keyword\"\n  }, \"export\"), \" \", mdx(\"span\", {\n    parentName: \"code\",\n    \"className\": \"token keyword\"\n  }, \"default\"), \" \", mdx(\"span\", {\n    parentName: \"code\",\n    \"className\": \"token keyword\"\n  }, \"function\"), \" \", mdx(\"span\", {\n    parentName: \"code\",\n    \"className\": \"token function\"\n  }, \"App\"), mdx(\"span\", {\n    parentName: \"code\",\n    \"className\": \"token punctuation\"\n  }, \"(\"), mdx(\"span\", {\n    parentName: \"code\",\n    \"className\": \"token punctuation\"\n  }, \")\"), \" \", mdx(\"span\", {\n    parentName: \"code\",\n    \"className\": \"token punctuation\"\n  }, \"{\"), \"\\n  \", mdx(\"span\", {\n    parentName: \"code\",\n    \"className\": \"token keyword\"\n  }, \"const\"), \" lastRef \", mdx(\"span\", {\n    parentName: \"code\",\n    \"className\": \"token operator\"\n  }, \"=\"), \" \", mdx(\"span\", {\n    parentName: \"code\",\n    \"className\": \"token function\"\n  }, \"useRef\"), mdx(\"span\", {\n    parentName: \"code\",\n    \"className\": \"token punctuation\"\n  }, \"(\"), mdx(\"span\", {\n    parentName: \"code\",\n    \"className\": \"token keyword\"\n  }, \"null\"), mdx(\"span\", {\n    parentName: \"code\",\n    \"className\": \"token punctuation\"\n  }, \")\"), mdx(\"span\", {\n    parentName: \"code\",\n    \"className\": \"token punctuation\"\n  }, \";\"), \"\\n  \", mdx(\"span\", {\n    parentName: \"code\",\n    \"className\": \"token keyword\"\n  }, \"const\"), \" \", mdx(\"span\", {\n    parentName: \"code\",\n    \"className\": \"token punctuation\"\n  }, \"[\"), \"isLoading\", mdx(\"span\", {\n    parentName: \"code\",\n    \"className\": \"token punctuation\"\n  }, \",\"), \" setIsLoading\", mdx(\"span\", {\n    parentName: \"code\",\n    \"className\": \"token punctuation\"\n  }, \"]\"), \" \", mdx(\"span\", {\n    parentName: \"code\",\n    \"className\": \"token operator\"\n  }, \"=\"), \" \", mdx(\"span\", {\n    parentName: \"code\",\n    \"className\": \"token function\"\n  }, \"useState\"), mdx(\"span\", {\n    parentName: \"code\",\n    \"className\": \"token punctuation\"\n  }, \"(\"), mdx(\"span\", {\n    parentName: \"code\",\n    \"className\": \"token boolean\"\n  }, \"false\"), mdx(\"span\", {\n    parentName: \"code\",\n    \"className\": \"token punctuation\"\n  }, \")\"), mdx(\"span\", {\n    parentName: \"code\",\n    \"className\": \"token punctuation\"\n  }, \";\"), \"\\n  \", mdx(\"span\", {\n    parentName: \"code\",\n    \"className\": \"token keyword\"\n  }, \"const\"), \" \", mdx(\"span\", {\n    parentName: \"code\",\n    \"className\": \"token punctuation\"\n  }, \"[\"), \"todos\", mdx(\"span\", {\n    parentName: \"code\",\n    \"className\": \"token punctuation\"\n  }, \",\"), \" setTodos\", mdx(\"span\", {\n    parentName: \"code\",\n    \"className\": \"token punctuation\"\n  }, \"]\"), \" \", mdx(\"span\", {\n    parentName: \"code\",\n    \"className\": \"token operator\"\n  }, \"=\"), \" \", mdx(\"span\", {\n    parentName: \"code\",\n    \"className\": \"token function\"\n  }, \"useState\"), mdx(\"span\", {\n    parentName: \"code\",\n    \"className\": \"token punctuation\"\n  }, \"(\"), mdx(\"span\", {\n    parentName: \"code\",\n    \"className\": \"token punctuation\"\n  }, \"{\"), \"\\n    itens\", mdx(\"span\", {\n    parentName: \"code\",\n    \"className\": \"token operator\"\n  }, \":\"), \" \", mdx(\"span\", {\n    parentName: \"code\",\n    \"className\": \"token punctuation\"\n  }, \"[\"), mdx(\"span\", {\n    parentName: \"code\",\n    \"className\": \"token punctuation\"\n  }, \"]\"), mdx(\"span\", {\n    parentName: \"code\",\n    \"className\": \"token punctuation\"\n  }, \",\"), \"\\n    page\", mdx(\"span\", {\n    parentName: \"code\",\n    \"className\": \"token operator\"\n  }, \":\"), \" \", mdx(\"span\", {\n    parentName: \"code\",\n    \"className\": \"token number\"\n  }, \"0\"), mdx(\"span\", {\n    parentName: \"code\",\n    \"className\": \"token punctuation\"\n  }, \",\"), \"\\n    totalPages\", mdx(\"span\", {\n    parentName: \"code\",\n    \"className\": \"token operator\"\n  }, \":\"), \" \", mdx(\"span\", {\n    parentName: \"code\",\n    \"className\": \"token number\"\n  }, \"1\"), mdx(\"span\", {\n    parentName: \"code\",\n    \"className\": \"token punctuation\"\n  }, \",\"), \"\\n  \", mdx(\"span\", {\n    parentName: \"code\",\n    \"className\": \"token punctuation\"\n  }, \"}\"), mdx(\"span\", {\n    parentName: \"code\",\n    \"className\": \"token punctuation\"\n  }, \")\"), mdx(\"span\", {\n    parentName: \"code\",\n    \"className\": \"token punctuation\"\n  }, \";\"), \"\\n\", mdx(\"span\", {\n    parentName: \"code\",\n    \"className\": \"gatsby-highlight-code-line\"\n  }), mdx(\"span\", {\n    parentName: \"code\",\n    \"className\": \"gatsby-highlight-code-line\"\n  }, \"  \", mdx(\"span\", {\n    parentName: \"span\",\n    \"className\": \"token keyword\"\n  }, \"const\"), \" isLastVisible \", mdx(\"span\", {\n    parentName: \"span\",\n    \"className\": \"token operator\"\n  }, \"=\"), \" \", mdx(\"span\", {\n    parentName: \"span\",\n    \"className\": \"token function\"\n  }, \"useIsElementVisible\"), mdx(\"span\", {\n    parentName: \"span\",\n    \"className\": \"token punctuation\"\n  }, \"(\"), \"lastRef\", mdx(\"span\", {\n    parentName: \"span\",\n    \"className\": \"token punctuation\"\n  }, \".\"), \"current\", mdx(\"span\", {\n    parentName: \"span\",\n    \"className\": \"token punctuation\"\n  }, \")\"), mdx(\"span\", {\n    parentName: \"span\",\n    \"className\": \"token punctuation\"\n  }, \";\")), mdx(\"span\", {\n    parentName: \"code\",\n    \"className\": \"gatsby-highlight-code-line\"\n  }), mdx(\"span\", {\n    parentName: \"code\",\n    \"className\": \"gatsby-highlight-code-line\"\n  }, \"  \", mdx(\"span\", {\n    parentName: \"span\",\n    \"className\": \"token function\"\n  }, \"useEffect\"), mdx(\"span\", {\n    parentName: \"span\",\n    \"className\": \"token punctuation\"\n  }, \"(\"), mdx(\"span\", {\n    parentName: \"span\",\n    \"className\": \"token punctuation\"\n  }, \"(\"), mdx(\"span\", {\n    parentName: \"span\",\n    \"className\": \"token punctuation\"\n  }, \")\"), \" \", mdx(\"span\", {\n    parentName: \"span\",\n    \"className\": \"token operator\"\n  }, \"=>\"), \" \", mdx(\"span\", {\n    parentName: \"span\",\n    \"className\": \"token punctuation\"\n  }, \"{\")), mdx(\"span\", {\n    parentName: \"code\",\n    \"className\": \"gatsby-highlight-code-line\"\n  }, \"    \", mdx(\"span\", {\n    parentName: \"span\",\n    \"className\": \"token comment\"\n  }, \"// Fetch on page mount.\")), mdx(\"span\", {\n    parentName: \"code\",\n    \"className\": \"gatsby-highlight-code-line\"\n  }, \"    \", mdx(\"span\", {\n    parentName: \"span\",\n    \"className\": \"token function\"\n  }, \"getMoreTodos\"), mdx(\"span\", {\n    parentName: \"span\",\n    \"className\": \"token punctuation\"\n  }, \"(\"), \"todos\", mdx(\"span\", {\n    parentName: \"span\",\n    \"className\": \"token punctuation\"\n  }, \".\"), \"page \", mdx(\"span\", {\n    parentName: \"span\",\n    \"className\": \"token operator\"\n  }, \"+\"), \" \", mdx(\"span\", {\n    parentName: \"span\",\n    \"className\": \"token number\"\n  }, \"1\"), mdx(\"span\", {\n    parentName: \"span\",\n    \"className\": \"token punctuation\"\n  }, \")\"), mdx(\"span\", {\n    parentName: \"span\",\n    \"className\": \"token punctuation\"\n  }, \";\")), mdx(\"span\", {\n    parentName: \"code\",\n    \"className\": \"gatsby-highlight-code-line\"\n  }, \"  \", mdx(\"span\", {\n    parentName: \"span\",\n    \"className\": \"token punctuation\"\n  }, \"}\"), mdx(\"span\", {\n    parentName: \"span\",\n    \"className\": \"token punctuation\"\n  }, \",\"), \" \", mdx(\"span\", {\n    parentName: \"span\",\n    \"className\": \"token punctuation\"\n  }, \"[\"), mdx(\"span\", {\n    parentName: \"span\",\n    \"className\": \"token punctuation\"\n  }, \"]\"), mdx(\"span\", {\n    parentName: \"span\",\n    \"className\": \"token punctuation\"\n  }, \")\"), mdx(\"span\", {\n    parentName: \"span\",\n    \"className\": \"token punctuation\"\n  }, \";\")), mdx(\"span\", {\n    parentName: \"code\",\n    \"className\": \"gatsby-highlight-code-line\"\n  }), mdx(\"span\", {\n    parentName: \"code\",\n    \"className\": \"gatsby-highlight-code-line\"\n  }, \"  \", mdx(\"span\", {\n    parentName: \"span\",\n    \"className\": \"token function\"\n  }, \"useEffect\"), mdx(\"span\", {\n    parentName: \"span\",\n    \"className\": \"token punctuation\"\n  }, \"(\"), mdx(\"span\", {\n    parentName: \"span\",\n    \"className\": \"token punctuation\"\n  }, \"(\"), mdx(\"span\", {\n    parentName: \"span\",\n    \"className\": \"token punctuation\"\n  }, \")\"), \" \", mdx(\"span\", {\n    parentName: \"span\",\n    \"className\": \"token operator\"\n  }, \"=>\"), \" \", mdx(\"span\", {\n    parentName: \"span\",\n    \"className\": \"token punctuation\"\n  }, \"{\")), mdx(\"span\", {\n    parentName: \"code\",\n    \"className\": \"gatsby-highlight-code-line\"\n  }, \"    \", mdx(\"span\", {\n    parentName: \"span\",\n    \"className\": \"token comment\"\n  }, \"// Fetch when the the div above our list is visible on screen\")), mdx(\"span\", {\n    parentName: \"code\",\n    \"className\": \"gatsby-highlight-code-line\"\n  }, \"    \", mdx(\"span\", {\n    parentName: \"span\",\n    \"className\": \"token keyword\"\n  }, \"if\"), \" \", mdx(\"span\", {\n    parentName: \"span\",\n    \"className\": \"token punctuation\"\n  }, \"(\"), \"isLastVisible\", mdx(\"span\", {\n    parentName: \"span\",\n    \"className\": \"token punctuation\"\n  }, \")\"), \" \", mdx(\"span\", {\n    parentName: \"span\",\n    \"className\": \"token punctuation\"\n  }, \"{\")), mdx(\"span\", {\n    parentName: \"code\",\n    \"className\": \"gatsby-highlight-code-line\"\n  }, \"      \", mdx(\"span\", {\n    parentName: \"span\",\n    \"className\": \"token function\"\n  }, \"getMoreTodos\"), mdx(\"span\", {\n    parentName: \"span\",\n    \"className\": \"token punctuation\"\n  }, \"(\"), \"todos\", mdx(\"span\", {\n    parentName: \"span\",\n    \"className\": \"token punctuation\"\n  }, \".\"), \"page \", mdx(\"span\", {\n    parentName: \"span\",\n    \"className\": \"token operator\"\n  }, \"+\"), \" \", mdx(\"span\", {\n    parentName: \"span\",\n    \"className\": \"token number\"\n  }, \"1\"), mdx(\"span\", {\n    parentName: \"span\",\n    \"className\": \"token punctuation\"\n  }, \")\"), mdx(\"span\", {\n    parentName: \"span\",\n    \"className\": \"token punctuation\"\n  }, \";\")), mdx(\"span\", {\n    parentName: \"code\",\n    \"className\": \"gatsby-highlight-code-line\"\n  }, \"    \", mdx(\"span\", {\n    parentName: \"span\",\n    \"className\": \"token punctuation\"\n  }, \"}\")), mdx(\"span\", {\n    parentName: \"code\",\n    \"className\": \"gatsby-highlight-code-line\"\n  }, \"  \", mdx(\"span\", {\n    parentName: \"span\",\n    \"className\": \"token punctuation\"\n  }, \"}\"), mdx(\"span\", {\n    parentName: \"span\",\n    \"className\": \"token punctuation\"\n  }, \",\"), \" \", mdx(\"span\", {\n    parentName: \"span\",\n    \"className\": \"token punctuation\"\n  }, \"[\"), \"isLastVisible\", mdx(\"span\", {\n    parentName: \"span\",\n    \"className\": \"token punctuation\"\n  }, \"]\"), mdx(\"span\", {\n    parentName: \"span\",\n    \"className\": \"token punctuation\"\n  }, \")\"), mdx(\"span\", {\n    parentName: \"span\",\n    \"className\": \"token punctuation\"\n  }, \";\")), mdx(\"span\", {\n    parentName: \"code\",\n    \"className\": \"gatsby-highlight-code-line\"\n  }), mdx(\"span\", {\n    parentName: \"code\",\n    \"className\": \"gatsby-highlight-code-line\"\n  }, \"  \", mdx(\"span\", {\n    parentName: \"span\",\n    \"className\": \"token keyword\"\n  }, \"const\"), \" \", mdx(\"span\", {\n    parentName: \"span\",\n    \"className\": \"token function-variable function\"\n  }, \"getMoreTodos\"), \" \", mdx(\"span\", {\n    parentName: \"span\",\n    \"className\": \"token operator\"\n  }, \"=\"), \" \", mdx(\"span\", {\n    parentName: \"span\",\n    \"className\": \"token keyword\"\n  }, \"async\"), \" \", mdx(\"span\", {\n    parentName: \"span\",\n    \"className\": \"token punctuation\"\n  }, \"(\"), mdx(\"span\", {\n    parentName: \"span\",\n    \"className\": \"token parameter\"\n  }, \"page\"), mdx(\"span\", {\n    parentName: \"span\",\n    \"className\": \"token punctuation\"\n  }, \")\"), \" \", mdx(\"span\", {\n    parentName: \"span\",\n    \"className\": \"token operator\"\n  }, \"=>\"), \" \", mdx(\"span\", {\n    parentName: \"span\",\n    \"className\": \"token punctuation\"\n  }, \"{\")), mdx(\"span\", {\n    parentName: \"code\",\n    \"className\": \"gatsby-highlight-code-line\"\n  }, \"    \", mdx(\"span\", {\n    parentName: \"span\",\n    \"className\": \"token keyword\"\n  }, \"try\"), \" \", mdx(\"span\", {\n    parentName: \"span\",\n    \"className\": \"token punctuation\"\n  }, \"{\")), mdx(\"span\", {\n    parentName: \"code\",\n    \"className\": \"gatsby-highlight-code-line\"\n  }, \"      \", mdx(\"span\", {\n    parentName: \"span\",\n    \"className\": \"token function\"\n  }, \"setIsLoading\"), mdx(\"span\", {\n    parentName: \"span\",\n    \"className\": \"token punctuation\"\n  }, \"(\"), mdx(\"span\", {\n    parentName: \"span\",\n    \"className\": \"token boolean\"\n  }, \"true\"), mdx(\"span\", {\n    parentName: \"span\",\n    \"className\": \"token punctuation\"\n  }, \")\"), mdx(\"span\", {\n    parentName: \"span\",\n    \"className\": \"token punctuation\"\n  }, \";\")), mdx(\"span\", {\n    parentName: \"code\",\n    \"className\": \"gatsby-highlight-code-line\"\n  }, \"      \", mdx(\"span\", {\n    parentName: \"span\",\n    \"className\": \"token keyword\"\n  }, \"const\"), \" newTodos \", mdx(\"span\", {\n    parentName: \"span\",\n    \"className\": \"token operator\"\n  }, \"=\"), \" \", mdx(\"span\", {\n    parentName: \"span\",\n    \"className\": \"token keyword\"\n  }, \"await\"), \" \", mdx(\"span\", {\n    parentName: \"span\",\n    \"className\": \"token function\"\n  }, \"fetchTodos\"), mdx(\"span\", {\n    parentName: \"span\",\n    \"className\": \"token punctuation\"\n  }, \"(\"), \"page\", mdx(\"span\", {\n    parentName: \"span\",\n    \"className\": \"token punctuation\"\n  }, \")\"), mdx(\"span\", {\n    parentName: \"span\",\n    \"className\": \"token punctuation\"\n  }, \";\")), mdx(\"span\", {\n    parentName: \"code\",\n    \"className\": \"gatsby-highlight-code-line\"\n  }, \"      \", mdx(\"span\", {\n    parentName: \"span\",\n    \"className\": \"token function\"\n  }, \"setTodos\"), mdx(\"span\", {\n    parentName: \"span\",\n    \"className\": \"token punctuation\"\n  }, \"(\"), mdx(\"span\", {\n    parentName: \"span\",\n    \"className\": \"token punctuation\"\n  }, \"(\"), mdx(\"span\", {\n    parentName: \"span\",\n    \"className\": \"token parameter\"\n  }, \"prev\"), mdx(\"span\", {\n    parentName: \"span\",\n    \"className\": \"token punctuation\"\n  }, \")\"), \" \", mdx(\"span\", {\n    parentName: \"span\",\n    \"className\": \"token operator\"\n  }, \"=>\"), \" \", mdx(\"span\", {\n    parentName: \"span\",\n    \"className\": \"token punctuation\"\n  }, \"(\"), mdx(\"span\", {\n    parentName: \"span\",\n    \"className\": \"token punctuation\"\n  }, \"{\")), mdx(\"span\", {\n    parentName: \"code\",\n    \"className\": \"gatsby-highlight-code-line\"\n  }, \"        \", mdx(\"span\", {\n    parentName: \"span\",\n    \"className\": \"token operator\"\n  }, \"...\"), \"newTodos\", mdx(\"span\", {\n    parentName: \"span\",\n    \"className\": \"token punctuation\"\n  }, \",\")), mdx(\"span\", {\n    parentName: \"code\",\n    \"className\": \"gatsby-highlight-code-line\"\n  }, \"        itens\", mdx(\"span\", {\n    parentName: \"span\",\n    \"className\": \"token operator\"\n  }, \":\"), \" prev\", mdx(\"span\", {\n    parentName: \"span\",\n    \"className\": \"token punctuation\"\n  }, \".\"), \"itens\", mdx(\"span\", {\n    parentName: \"span\",\n    \"className\": \"token punctuation\"\n  }, \".\"), mdx(\"span\", {\n    parentName: \"span\",\n    \"className\": \"token function\"\n  }, \"concat\"), mdx(\"span\", {\n    parentName: \"span\",\n    \"className\": \"token punctuation\"\n  }, \"(\"), \"newTodos\", mdx(\"span\", {\n    parentName: \"span\",\n    \"className\": \"token punctuation\"\n  }, \".\"), \"itens\", mdx(\"span\", {\n    parentName: \"span\",\n    \"className\": \"token punctuation\"\n  }, \")\"), mdx(\"span\", {\n    parentName: \"span\",\n    \"className\": \"token punctuation\"\n  }, \",\")), mdx(\"span\", {\n    parentName: \"code\",\n    \"className\": \"gatsby-highlight-code-line\"\n  }, \"      \", mdx(\"span\", {\n    parentName: \"span\",\n    \"className\": \"token punctuation\"\n  }, \"}\"), mdx(\"span\", {\n    parentName: \"span\",\n    \"className\": \"token punctuation\"\n  }, \")\"), mdx(\"span\", {\n    parentName: \"span\",\n    \"className\": \"token punctuation\"\n  }, \")\"), mdx(\"span\", {\n    parentName: \"span\",\n    \"className\": \"token punctuation\"\n  }, \";\")), mdx(\"span\", {\n    parentName: \"code\",\n    \"className\": \"gatsby-highlight-code-line\"\n  }, \"      \", mdx(\"span\", {\n    parentName: \"span\",\n    \"className\": \"token function\"\n  }, \"setIsLoading\"), mdx(\"span\", {\n    parentName: \"span\",\n    \"className\": \"token punctuation\"\n  }, \"(\"), mdx(\"span\", {\n    parentName: \"span\",\n    \"className\": \"token boolean\"\n  }, \"false\"), mdx(\"span\", {\n    parentName: \"span\",\n    \"className\": \"token punctuation\"\n  }, \")\"), mdx(\"span\", {\n    parentName: \"span\",\n    \"className\": \"token punctuation\"\n  }, \";\")), mdx(\"span\", {\n    parentName: \"code\",\n    \"className\": \"gatsby-highlight-code-line\"\n  }, \"    \", mdx(\"span\", {\n    parentName: \"span\",\n    \"className\": \"token punctuation\"\n  }, \"}\"), \" \", mdx(\"span\", {\n    parentName: \"span\",\n    \"className\": \"token keyword\"\n  }, \"catch\"), \" \", mdx(\"span\", {\n    parentName: \"span\",\n    \"className\": \"token punctuation\"\n  }, \"(\"), \"err\", mdx(\"span\", {\n    parentName: \"span\",\n    \"className\": \"token punctuation\"\n  }, \")\"), \" \", mdx(\"span\", {\n    parentName: \"span\",\n    \"className\": \"token punctuation\"\n  }, \"{\"), mdx(\"span\", {\n    parentName: \"span\",\n    \"className\": \"token punctuation\"\n  }, \"}\")), mdx(\"span\", {\n    parentName: \"code\",\n    \"className\": \"gatsby-highlight-code-line\"\n  }, \"  \", mdx(\"span\", {\n    parentName: \"span\",\n    \"className\": \"token punctuation\"\n  }, \"}\"), mdx(\"span\", {\n    parentName: \"span\",\n    \"className\": \"token punctuation\"\n  }, \";\")), \"\\n  \", mdx(\"span\", {\n    parentName: \"code\",\n    \"className\": \"token keyword\"\n  }, \"return\"), \" \", mdx(\"span\", {\n    parentName: \"code\",\n    \"className\": \"token punctuation\"\n  }, \"(\"), \"\\n    \", mdx(\"span\", {\n    parentName: \"code\",\n    \"className\": \"token operator\"\n  }, \"<\"), \"div\", mdx(\"span\", {\n    parentName: \"code\",\n    \"className\": \"token operator\"\n  }, \">\"), \"\\n      \", mdx(\"span\", {\n    parentName: \"code\",\n    \"className\": \"token operator\"\n  }, \"<\"), \"h2\", mdx(\"span\", {\n    parentName: \"code\",\n    \"className\": \"token operator\"\n  }, \">\"), \"Lorem ipsum's list\", mdx(\"span\", {\n    parentName: \"code\",\n    \"className\": \"token operator\"\n  }, \"<\"), mdx(\"span\", {\n    parentName: \"code\",\n    \"className\": \"token operator\"\n  }, \"/\"), \"h2\", mdx(\"span\", {\n    parentName: \"code\",\n    \"className\": \"token operator\"\n  }, \">\"), \"\\n      \", mdx(\"span\", {\n    parentName: \"code\",\n    \"className\": \"token punctuation\"\n  }, \"{\"), \"todos\", mdx(\"span\", {\n    parentName: \"code\",\n    \"className\": \"token punctuation\"\n  }, \".\"), \"itens\", mdx(\"span\", {\n    parentName: \"code\",\n    \"className\": \"token punctuation\"\n  }, \".\"), mdx(\"span\", {\n    parentName: \"code\",\n    \"className\": \"token function\"\n  }, \"map\"), mdx(\"span\", {\n    parentName: \"code\",\n    \"className\": \"token punctuation\"\n  }, \"(\"), mdx(\"span\", {\n    parentName: \"code\",\n    \"className\": \"token punctuation\"\n  }, \"(\"), mdx(\"span\", {\n    parentName: \"code\",\n    \"className\": \"token parameter\"\n  }, mdx(\"span\", {\n    parentName: \"span\",\n    \"className\": \"token punctuation\"\n  }, \"{\"), \" title \", mdx(\"span\", {\n    parentName: \"span\",\n    \"className\": \"token punctuation\"\n  }, \"}\"), mdx(\"span\", {\n    parentName: \"span\",\n    \"className\": \"token punctuation\"\n  }, \",\"), \" index\"), mdx(\"span\", {\n    parentName: \"code\",\n    \"className\": \"token punctuation\"\n  }, \")\"), \" \", mdx(\"span\", {\n    parentName: \"code\",\n    \"className\": \"token operator\"\n  }, \"=>\"), \" \", mdx(\"span\", {\n    parentName: \"code\",\n    \"className\": \"token punctuation\"\n  }, \"{\"), \"\\n        \", mdx(\"span\", {\n    parentName: \"code\",\n    \"className\": \"token keyword\"\n  }, \"return\"), \" \", mdx(\"span\", {\n    parentName: \"code\",\n    \"className\": \"token punctuation\"\n  }, \"(\"), \"\\n          \", mdx(\"span\", {\n    parentName: \"code\",\n    \"className\": \"token operator\"\n  }, \"<\"), \"div key\", mdx(\"span\", {\n    parentName: \"code\",\n    \"className\": \"token operator\"\n  }, \"=\"), mdx(\"span\", {\n    parentName: \"code\",\n    \"className\": \"token punctuation\"\n  }, \"{\"), \"index\", mdx(\"span\", {\n    parentName: \"code\",\n    \"className\": \"token punctuation\"\n  }, \"}\"), mdx(\"span\", {\n    parentName: \"code\",\n    \"className\": \"token operator\"\n  }, \">\"), \"\\n            \", mdx(\"span\", {\n    parentName: \"code\",\n    \"className\": \"token operator\"\n  }, \"<\"), \"p\", mdx(\"span\", {\n    parentName: \"code\",\n    \"className\": \"token operator\"\n  }, \">\"), mdx(\"span\", {\n    parentName: \"code\",\n    \"className\": \"token punctuation\"\n  }, \"{\"), \"title\", mdx(\"span\", {\n    parentName: \"code\",\n    \"className\": \"token punctuation\"\n  }, \"}\"), mdx(\"span\", {\n    parentName: \"code\",\n    \"className\": \"token operator\"\n  }, \"<\"), mdx(\"span\", {\n    parentName: \"code\",\n    \"className\": \"token operator\"\n  }, \"/\"), \"p\", mdx(\"span\", {\n    parentName: \"code\",\n    \"className\": \"token operator\"\n  }, \">\"), \"\\n          \", mdx(\"span\", {\n    parentName: \"code\",\n    \"className\": \"token operator\"\n  }, \"<\"), mdx(\"span\", {\n    parentName: \"code\",\n    \"className\": \"token operator\"\n  }, \"/\"), \"div\", mdx(\"span\", {\n    parentName: \"code\",\n    \"className\": \"token operator\"\n  }, \">\"), \"\\n        \", mdx(\"span\", {\n    parentName: \"code\",\n    \"className\": \"token punctuation\"\n  }, \")\"), mdx(\"span\", {\n    parentName: \"code\",\n    \"className\": \"token punctuation\"\n  }, \";\"), \"\\n      \", mdx(\"span\", {\n    parentName: \"code\",\n    \"className\": \"token punctuation\"\n  }, \"}\"), mdx(\"span\", {\n    parentName: \"code\",\n    \"className\": \"token punctuation\"\n  }, \")\"), mdx(\"span\", {\n    parentName: \"code\",\n    \"className\": \"token punctuation\"\n  }, \"}\"), \"\\n      \", mdx(\"span\", {\n    parentName: \"code\",\n    \"className\": \"token punctuation\"\n  }, \"{\"), mdx(\"span\", {\n    parentName: \"code\",\n    \"className\": \"token operator\"\n  }, \"!\"), mdx(\"span\", {\n    parentName: \"code\",\n    \"className\": \"token operator\"\n  }, \"!\"), \"todos\", mdx(\"span\", {\n    parentName: \"code\",\n    \"className\": \"token punctuation\"\n  }, \".\"), \"itens\", mdx(\"span\", {\n    parentName: \"code\",\n    \"className\": \"token punctuation\"\n  }, \".\"), \"length \", mdx(\"span\", {\n    parentName: \"code\",\n    \"className\": \"token operator\"\n  }, \"&&\"), \" todos\", mdx(\"span\", {\n    parentName: \"code\",\n    \"className\": \"token punctuation\"\n  }, \".\"), \"page \", mdx(\"span\", {\n    parentName: \"code\",\n    \"className\": \"token operator\"\n  }, \"<\"), \" todos\", mdx(\"span\", {\n    parentName: \"code\",\n    \"className\": \"token punctuation\"\n  }, \".\"), \"totalPages \", mdx(\"span\", {\n    parentName: \"code\",\n    \"className\": \"token operator\"\n  }, \"&&\"), \" \", mdx(\"span\", {\n    parentName: \"code\",\n    \"className\": \"token punctuation\"\n  }, \"(\"), \"\\n        \", mdx(\"span\", {\n    parentName: \"code\",\n    \"className\": \"token operator\"\n  }, \"<\"), \"div ref\", mdx(\"span\", {\n    parentName: \"code\",\n    \"className\": \"token operator\"\n  }, \"=\"), mdx(\"span\", {\n    parentName: \"code\",\n    \"className\": \"token punctuation\"\n  }, \"{\"), \"lastRef\", mdx(\"span\", {\n    parentName: \"code\",\n    \"className\": \"token punctuation\"\n  }, \"}\"), \" \", mdx(\"span\", {\n    parentName: \"code\",\n    \"className\": \"token operator\"\n  }, \"/\"), mdx(\"span\", {\n    parentName: \"code\",\n    \"className\": \"token operator\"\n  }, \">\"), \"\\n      \", mdx(\"span\", {\n    parentName: \"code\",\n    \"className\": \"token punctuation\"\n  }, \")\"), mdx(\"span\", {\n    parentName: \"code\",\n    \"className\": \"token punctuation\"\n  }, \"}\"), \"\\n      \", mdx(\"span\", {\n    parentName: \"code\",\n    \"className\": \"token punctuation\"\n  }, \"{\"), \"isLoading \", mdx(\"span\", {\n    parentName: \"code\",\n    \"className\": \"token operator\"\n  }, \"&&\"), \" \", mdx(\"span\", {\n    parentName: \"code\",\n    \"className\": \"token operator\"\n  }, \"<\"), \"p\", mdx(\"span\", {\n    parentName: \"code\",\n    \"className\": \"token operator\"\n  }, \">\"), \"Loading\", mdx(\"span\", {\n    parentName: \"code\",\n    \"className\": \"token operator\"\n  }, \"...\"), mdx(\"span\", {\n    parentName: \"code\",\n    \"className\": \"token operator\"\n  }, \"<\"), mdx(\"span\", {\n    parentName: \"code\",\n    \"className\": \"token operator\"\n  }, \"/\"), \"p\", mdx(\"span\", {\n    parentName: \"code\",\n    \"className\": \"token operator\"\n  }, \">\"), mdx(\"span\", {\n    parentName: \"code\",\n    \"className\": \"token punctuation\"\n  }, \"}\"), \"\\n    \", mdx(\"span\", {\n    parentName: \"code\",\n    \"className\": \"token operator\"\n  }, \"<\"), mdx(\"span\", {\n    parentName: \"code\",\n    \"className\": \"token operator\"\n  }, \"/\"), \"div\", mdx(\"span\", {\n    parentName: \"code\",\n    \"className\": \"token operator\"\n  }, \">\"), \"\\n  \", mdx(\"span\", {\n    parentName: \"code\",\n    \"className\": \"token punctuation\"\n  }, \")\"), mdx(\"span\", {\n    parentName: \"code\",\n    \"className\": \"token punctuation\"\n  }, \";\"), \"\\n\", mdx(\"span\", {\n    parentName: \"code\",\n    \"className\": \"token punctuation\"\n  }, \"}\")))), mdx(\"h3\", null, \"Conclusion\"), mdx(\"p\", null, \"Now we're done. I created a simple example to fetch the data and show a loading, in the real world you also need to handle with the fetch exception using catch on your async method.\"), mdx(\"p\", null, \"You can see \", mdx(\"a\", {\n    parentName: \"p\",\n    \"href\": \"https://react-hooks-infinite-scroll.netlify.app/\"\n  }, \"the demo\"), \" right here or \", mdx(\"a\", {\n    parentName: \"p\",\n    \"href\": \"https://github.com/Sergioamjr/react-infinite-scroll-example\"\n  }, \"the repository\"), \".\"));\n}\n;\nMDXContent.isMDXComponent = true;","id":"3f3821c3-3000-56e7-a7f1-3c6a2468b64b","frontmatter":{"path":"/posts_en/infinite-scroll-with-react-hooks","title":"Infinite scroll with React Hooks","caption":"Photo by Kelly Sikkema no Unsplash","translate":"/scroll-infinito-com-react-hooks","excerpt":"Infinite scroll is not usual to see on websites nowadays but it may be very useful to show a list without pagination or user interaction. [â€¦]","date":"2020-02-14T00:00:00.000Z","image":{"childImageSharp":{"original":{"src":"/static/thumbnail-5ecdb522f4e4798cc39ae8e6802a34a0.jpg"}}}}}}},"staticQueryHashes":["63159454"]}